{
  "schema_version": "1.0",
  "kind": "fabrication-material-profile",
  "material_id": "wood-sheet-3mm",
  "name": "3 mm 木板",
  "material_family": "wood-sheet",
  "default_thickness_mm": 3.0,
  "thickness_adjustable": true,
  "recommended_for": ["laser-cut-box", "mounting-plate", "classroom-prototype"],
  "kerf": {
    "status": "measure-before-tight-fit",
    "value_mm": null
  },
  "machine_parameters": {
    "status": "calibration-required",
    "power": null,
    "speed": null,
    "passes": null
  },
  "source_ids": ["chatmaker-default-material-2026-08-17"],
  "verification": {
    "product_default": "user-confirmed",
    "physical_cut": "unverified"
  }
}
